company_name,job_title,apply_link,job_type_time,is_rolling,location,ddl,start_time,duration,salary,description,keyworkds
Amd,Sr. Staff Design Verification Engineer,https://careers.amd.com/careers-home/jobs/42050?lang=en-us,,false,GB,,,,,,
Amd,Sr. Digital Design Engineer,https://careers.amd.com/careers-home/jobs/42008?lang=en-us,,false,GB,,,,,,
Amd,Graduate Design Engineer,https://careers.amd.com/careers-home/jobs/33740?lang=en-us,,false,GB,,,,,,
Amd,Staff Design Engineer,https://careers.amd.com/careers-home/jobs/37471?lang=en-us,,false,GB,,,,,,
Amd,GPU Hardware Architecture engineer,https://careers.amd.com/careers-home/jobs/42945?lang=en-us,,false,GB,,,,,,
Amd,Senior AI GPU Compiler Engineer - LLVM,https://careers.amd.com/careers-home/jobs/39819?lang=en-us,,false,GB,,,,,,
Amd,AI Framework Software Development Engineer,https://careers.amd.com/careers-home/jobs/39198?lang=en-us,,false,GB,,,,,,
Amd,Senior Staff Software Development Engineer - LLVM Compiler,https://careers.amd.com/careers-home/jobs/37860?lang=en-us,,false,GB,,,,,,
Amd,Senior Channel Marketing Specialist (contract),https://careers.amd.com/careers-home/jobs/39015?lang=en-us,,false,GB,,,,,,
Amd,SW Systems Modeling engineer,https://careers.amd.com/careers-home/jobs/37350?lang=en-us,,false,GB,,,,,,
Amd,AI Framework Software Development Engineer,https://careers.amd.com/careers-home/jobs/38175?lang=en-us,,false,GB,,,,,,
Amd,Emulation/Prototyping Engineer,https://careers.amd.com/careers-home/jobs/42602?lang=en-us,,false,GB,,,,,,
Amd,Emulation/Prototyping Engineer,https://careers.amd.com/careers-home/jobs/42667?lang=en-us,,false,GB,,,,,,
Amd,Analog Design Engineer,https://careers.amd.com/careers-home/jobs/40972?lang=en-us,,false,GB,,,,,,
Amd,Senior Virtual Software Modeling Engineer,https://careers.amd.com/careers-home/jobs/42130?lang=en-us,,false,GB,,,,,,
Amd,GPU Verification Engineer,https://careers.amd.com/careers-home/jobs/42583?lang=en-us,,false,GB,,,,,,
Amd,GPU Silicon Design Engineer,https://careers.amd.com/careers-home/jobs/42584?lang=en-us,,false,GB,,,,,,
Amd,Senior GPU Verification Engineer,https://careers.amd.com/careers-home/jobs/42585?lang=en-us,,false,GB,,,,,,
Amd,GPU Verification Engineer (Senior/Lead),https://careers.amd.com/careers-home/jobs/42582?lang=en-us,,false,GB,,,,,,
Amd,Research CPU Design Engineer,https://careers.amd.com/careers-home/jobs/41801?lang=en-us,,false,GB,,,,,,
Amd,MTS CPU Core uArch/RTL Design Engineer,https://careers.amd.com/careers-home/jobs/42214?lang=en-us,,false,GB,,,,,,
Amd,Emulation Methodology Engineer,https://careers.amd.com/careers-home/jobs/42081?lang=en-us,,false,GB,,,,,,
Amd,Sr. CPU Core uArch/RTL Design Engineer,https://careers.amd.com/careers-home/jobs/42216?lang=en-us,,false,GB,,,,,,
Amd,Software System Design Engineer,https://careers.amd.com/careers-home/jobs/42194?lang=en-us,,false,GB,,,,,,
Amd,MTS CPU Core Physical Design Engineer,https://careers.amd.com/careers-home/jobs/42049?lang=en-us,,false,GB,,,,,,
Amd,MTS CPU Verification Design Engineer,https://careers.amd.com/careers-home/jobs/42051?lang=en-us,,false,GB,,,,,,
Amd,CPU Design Verification Engineer,https://careers.amd.com/careers-home/jobs/41970?lang=en-us,,false,GB,,,,,,
Amd,Sr CPU Physical Design Engineer,https://careers.amd.com/careers-home/jobs/41949?lang=en-us,,false,GB,,,,,,
Amd,CPU Design Verification Engineer,https://careers.amd.com/careers-home/jobs/37985?lang=en-us,,false,GB,,,,,,
Amd,Hardware IP Verification Engineer - Video,https://careers.amd.com/careers-home/jobs/35991?lang=en-us,,false,GB,,,,,,
Amd,Sr. Manager CPU Design Verification,https://careers.amd.com/careers-home/jobs/35175?lang=en-us,,false,GB,,,,,,
Amd,Hardware IP Engineer - Video,https://careers.amd.com/careers-home/jobs/34809?lang=en-us,,false,GB,,,,,,
